{
  "$schema": "../Schemas/economy-resources.schema.json",
  "schema": "moyva.economy-resources",
  "version": 1,
  "databaseAsset": "Assets/Moyva/Data/ScriptableObjects/Economy/EconomyDatabase.asset",
  "resources": [
    {
      "asset": "Assets/Moyva/Data/ScriptableObjects/Economy/Resources/Aloe-herb.asset",
      "id": "aloe-herb-food-resources",
      "displayName": "Aloe-herb",
      "category": "Food",
      "icon": {
        "path": "Assets/Moyva/Art/Sprites/16x16 Pixel Art Item Icons/16x16 items sheet.png",
        "guid": "62d7684d3d2d286709a275989698a69d",
        "subAsset": "16x16 items sheet_115",
        "localId": 1608824613
      },
      "stackLimit": 32,
      "weightGrams": 1000
    },
    {
      "asset": "Assets/Moyva/Data/ScriptableObjects/Economy/Resources/Amber-crystal.asset",
      "id": "pearl-white-materials-resources",
      "displayName": "Pearl-white",
      "category": "Materials",
      "icon": {
        "path": "Assets/Moyva/Art/Sprites/16x16 Pixel Art Item Icons/16x16 items sheet.png",
        "guid": "62d7684d3d2d286709a275989698a69d",
        "subAsset": "16x16 items sheet_20",
        "localId": 1056939201
      },
      "stackLimit": 32,
      "weightGrams": 1000
    },
    {
      "asset": "Assets/Moyva/Data/ScriptableObjects/Economy/Resources/Amethyst.asset",
      "id": "amethyst-materials-resources",
      "displayName": "Amethyst",
      "category": "Materials",
      "icon": {
        "path": "Assets/Moyva/Art/Sprites/16x16 Pixel Art Item Icons/16x16 items sheet.png",
        "guid": "62d7684d3d2d286709a275989698a69d",
        "subAsset": "16x16 items sheet_13",
        "localId": -147323449
      },
      "stackLimit": 32,
      "weightGrams": 1000
    },
    {
      "asset": "Assets/Moyva/Data/ScriptableObjects/Economy/Resources/Bark.asset",
      "id": "hide-materials-resources",
      "displayName": "Hide",
      "category": "Materials",
      "icon": {
        "path": "Assets/Moyva/Art/Sprites/16x16 Pixel Art Item Icons/16x16 items sheet.png",
        "guid": "62d7684d3d2d286709a275989698a69d",
        "subAsset": "16x16 items sheet_2",
        "localId": -1768132216
      },
      "stackLimit": 32,
      "weightGrams": 1000
    },
    {
      "asset": "Assets/Moyva/Data/ScriptableObjects/Economy/Resources/Barrel.asset",
      "id": "barrel-materials-resources",
      "displayName": "Barrel",
      "category": "Materials",
      "icon": {
        "path": "Assets/Moyva/Art/Sprites/16x16 Pixel Art Item Icons/16x16 items sheet.png",
        "guid": "62d7684d3d2d286709a275989698a69d",
        "subAsset": "16x16 items sheet_142",
        "localId": -1543548372
      },
      "stackLimit": 32,
      "weightGrams": 1000
    },
    {
      "asset": "Assets/Moyva/Data/ScriptableObjects/Economy/Resources/Beef-cut.asset",
      "id": "beef-cut-food-resources",
      "displayName": "Beef-cut",
      "category": "Food",
      "icon": {
        "path": "Assets/Moyva/Art/Sprites/16x16 Pixel Art Item Icons/16x16 items sheet.png",
        "guid": "62d7684d3d2d286709a275989698a69d",
        "subAsset": "16x16 items sheet_187",
        "localId": 1534047610
      },
      "stackLimit": 32,
      "weightGrams": 1000
    },
    {
      "asset": "Assets/Moyva/Data/ScriptableObjects/Economy/Resources/Beetroot.asset",
      "id": "root-purple-food-resources",
      "displayName": "Root-purple",
      "category": "Food",
      "icon": {
        "path": "Assets/Moyva/Art/Sprites/16x16 Pixel Art Item Icons/16x16 items sheet.png",
        "guid": "62d7684d3d2d286709a275989698a69d",
        "subAsset": "16x16 items sheet_42",
        "localId": -247198273
      },
      "stackLimit": 32,
      "weightGrams": 1000
    },
    {
      "asset": "Assets/Moyva/Data/ScriptableObjects/Economy/Resources/Berry-bunch.asset",
      "id": "bolt-blue-food-resources",
      "displayName": "Bolt-blue",
      "category": "Food",
      "icon": {
        "path": "Assets/Moyva/Art/Sprites/16x16 Pixel Art Item Icons/16x16 items sheet.png",
        "guid": "62d7684d3d2d286709a275989698a69d",
        "subAsset": "16x16 items sheet_44",
        "localId": -480449755
      },
      "stackLimit": 32,
      "weightGrams": 1000
    },
    {
      "asset": "Assets/Moyva/Data/ScriptableObjects/Economy/Resources/Blue-gem.asset",
      "id": "green-gem-materials-resources",
      "displayName": "Green-gem",
      "category": "Materials",
      "icon": {
        "path": "Assets/Moyva/Art/Sprites/16x16 Pixel Art Item Icons/16x16 items sheet.png",
        "guid": "62d7684d3d2d286709a275989698a69d",
        "subAsset": "16x16 items sheet_17",
        "localId": 1194725956
      },
      "stackLimit": 32,
      "weightGrams": 1000
    },
    {
      "asset": "Assets/Moyva/Data/ScriptableObjects/Economy/Resources/Blueberries.asset",
      "id": "axe-silver-food-resources",
      "displayName": "Axe-silver",
      "category": "Food",
      "icon": {
        "path": "Assets/Moyva/Art/Sprites/16x16 Pixel Art Item Icons/16x16 items sheet.png",
        "guid": "62d7684d3d2d286709a275989698a69d",
        "subAsset": "16x16 items sheet_40",
        "localId": -1145804333
      },
      "stackLimit": 32,
      "weightGrams": 1000
    },
    {
      "asset": "Assets/Moyva/Data/ScriptableObjects/Economy/Resources/Bone-fragment.asset",
      "id": "bone-fragment-materials-resources",
      "displayName": "Bone-fragment",
      "category": "Materials",
      "icon": {
        "path": "Assets/Moyva/Art/Sprites/16x16 Pixel Art Item Icons/16x16 items sheet.png",
        "guid": "62d7684d3d2d286709a275989698a69d",
        "subAsset": "16x16 items sheet_57",
        "localId": 2026243473
      },
      "stackLimit": 32,
      "weightGrams": 1000
    },
    {
      "asset": "Assets/Moyva/Data/ScriptableObjects/Economy/Resources/Bowl.asset",
      "id": "cup-gold-materials-resources",
      "displayName": "Cup-gold",
      "category": "Materials",
      "icon": {
        "path": "Assets/Moyva/Art/Sprites/16x16 Pixel Art Item Icons/16x16 items sheet.png",
        "guid": "62d7684d3d2d286709a275989698a69d",
        "subAsset": "16x16 items sheet_143",
        "localId": 101834564
      },
      "stackLimit": 32,
      "weightGrams": 1000
    },
    {
      "asset": "Assets/Moyva/Data/ScriptableObjects/Economy/Resources/Bread-loaf.asset",
      "id": "sticks-brown-food-resources",
      "displayName": "Sticks-brown",
      "category": "Food",
      "icon": {
        "path": "Assets/Moyva/Art/Sprites/16x16 Pixel Art Item Icons/16x16 items sheet.png",
        "guid": "62d7684d3d2d286709a275989698a69d",
        "subAsset": "16x16 items sheet_45",
        "localId": -226280218
      },
      "stackLimit": 32,
      "weightGrams": 1000
    },
    {
      "asset": "Assets/Moyva/Data/ScriptableObjects/Economy/Resources/Brick.asset",
      "id": "brick-materials-resources",
      "displayName": "Brick",
      "category": "Materials",
      "icon": {
        "path": "Assets/Moyva/Art/Sprites/16x16 Pixel Art Item Icons/16x16 items sheet.png",
        "guid": "62d7684d3d2d286709a275989698a69d",
        "subAsset": "16x16 items sheet_31",
        "localId": -843569825
      },
      "stackLimit": 32,
      "weightGrams": 1000
    },
    {
      "asset": "Assets/Moyva/Data/ScriptableObjects/Economy/Resources/Bronze-block.asset",
      "id": "bronze-block-materials-resources",
      "displayName": "Bronze-block",
      "category": "Materials",
      "icon": {
        "path": "Assets/Moyva/Art/Sprites/16x16 Pixel Art Item Icons/16x16 items sheet.png",
        "guid": "62d7684d3d2d286709a275989698a69d",
        "subAsset": "16x16 items sheet_32",
        "localId": 650760849
      },
      "stackLimit": 32,
      "weightGrams": 1000
    },
    {
      "asset": "Assets/Moyva/Data/ScriptableObjects/Economy/Resources/Cabbage.asset",
      "id": "cabbage-food-resources",
      "displayName": "Cabbage",
      "category": "Food",
      "icon": {
        "path": "Assets/Moyva/Art/Sprites/16x16 Pixel Art Item Icons/16x16 items sheet.png",
        "guid": "62d7684d3d2d286709a275989698a69d",
        "subAsset": "16x16 items sheet_46",
        "localId": 320827400
      },
      "stackLimit": 32,
      "weightGrams": 1000
    },
    {
      "asset": "Assets/Moyva/Data/ScriptableObjects/Economy/Resources/Carrot.asset",
      "id": "cheese-yellow-food-resources",
      "displayName": "Cheese-yellow",
      "category": "Food",
      "icon": {
        "path": "Assets/Moyva/Art/Sprites/16x16 Pixel Art Item Icons/16x16 items sheet.png",
        "guid": "62d7684d3d2d286709a275989698a69d",
        "subAsset": "16x16 items sheet_236",
        "localId": 1438883814
      },
      "stackLimit": 32,
      "weightGrams": 1000
    },
    {
      "asset": "Assets/Moyva/Data/ScriptableObjects/Economy/Resources/Cherries.asset",
      "id": "cherries-food-resources",
      "displayName": "Cherries",
      "category": "Food",
      "icon": {
        "path": "Assets/Moyva/Art/Sprites/16x16 Pixel Art Item Icons/16x16 items sheet.png",
        "guid": "62d7684d3d2d286709a275989698a69d",
        "subAsset": "16x16 items sheet_239",
        "localId": 826176627
      },
      "stackLimit": 32,
      "weightGrams": 1000
    },
    {
      "asset": "Assets/Moyva/Data/ScriptableObjects/Economy/Resources/Claw.asset",
      "id": "coin-gold-materials-resources",
      "displayName": "Coin-gold",
      "category": "Materials",
      "icon": {
        "path": "Assets/Moyva/Art/Sprites/16x16 Pixel Art Item Icons/16x16 items sheet.png",
        "guid": "62d7684d3d2d286709a275989698a69d",
        "subAsset": "16x16 items sheet_56",
        "localId": 1629802247
      },
      "stackLimit": 32,
      "weightGrams": 1000
    },
    {
      "asset": "Assets/Moyva/Data/ScriptableObjects/Economy/Resources/Cloth-blue.asset",
      "id": "axe-white-materials-resources",
      "displayName": "Axe-white",
      "category": "Materials",
      "icon": {